{
  "version": 1,
  "kind": "cleave.bundle",
  "run_id": "20260927-sample-184",
  "source": "ide",
  "run_kind": "cleave",
  "title": "Add cancellations & refunds",
  "repo": {
    "full_name": "galaxium/galaxium-travels",
    "default_branch": "main"
  },
  "pull_request": {
    "number": 184,
    "url": null,
    "head_branch": "feature/cancellations",
    "base_branch": "main",
    "author": null
  },
  "eval": null,
  "created_at": "2026-09-26T21:22:53.202Z",
  "atoms": {
    "version": 1,
    "base_sha": "c10e8e1b88657567b12252359fa7af2f7face097",
    "head_sha": "3c90564ddd14fc947911bb640f76801face3ba07",
    "head_tree": "9c1e47d2a8f1b3c5d7e9f0a1b2c3d4e5f6a7b8c9",
    "atoms": [
      {
        "id": "1fa843019af6",
        "file": "booking_system_backend/models.py",
        "old_file": null,
        "kind": "hunk",
        "old_start": 0,
        "old_len": 0,
        "new_start": 0,
        "new_len": 0,
        "added": 9,
        "removed": 0,
        "patch": "@@ -9,0 +10,9 @@ from database import Base\n+\n+\n+class BookingStatus(str, enum.Enum):\n+    \"\"\"Lifecycle of a booking.\"\"\"\n+\n+    CONFIRMED = \"confirmed\"\n+    CANCELLED = \"cancelled\"\n+    REFUNDED = \"refunded\"\n+",
        "is_test": false,
        "symbols": null
      },
      {
        "id": "39d972d365b4",
        "file": "booking_system_backend/models.py",
        "old_file": null,
        "kind": "hunk",
        "old_start": 0,
        "old_len": 0,
        "new_start": 0,
        "new_len": 0,
        "added": 3,
        "removed": 0,
        "patch": "@@ -41,0 +51,3 @@ class Booking(Base):\n+    status = Column(Enum(BookingStatus), nullable=False, default=BookingStatus.CONFIRMED)\n+    cancelled_at = Column(DateTime, nullable=True)\n+    cancellation_reason = Column(String, nullable=True)",
        "is_test": false,
        "symbols": null
      },
      {
        "id": "427325129f09",
        "file": "booking_system_backend/models.py",
        "old_file": null,
        "kind": "hunk",
        "old_start": 0,
        "old_len": 0,
        "new_start": 0,
        "new_len": 0,
        "added": 1,
        "removed": 0,
        "patch": "@@ -44,0 +55,1 @@ class Booking(Base):\n+    refunds = relationship(\"Refund\", back_populates=\"booking\", cascade=\"all, delete-orphan\")",
        "is_test": false,
        "symbols": null
      },
      {
        "id": "ac882d359af6",
        "file": "booking_system_backend/models.py",
        "old_file": null,
        "kind": "hunk",
        "old_start": 0,
        "old_len": 0,
        "new_start": 0,
        "new_len": 0,
        "added": 16,
        "removed": 0,
        "patch": "@@ -52,0 +67,16 @@ class Booking(Base):\n+\n+\n+class Refund(Base):\n+    __tablename__ = \"refunds\"\n+\n+    refund_id = Column(Integer, primary_key=True, index=True)\n+    booking_id = Column(Integer, ForeignKey(\"bookings.booking_id\"), nullable=False)\n+    amount = Column(Float, nullable=False)\n+    percentage = Column(Integer, nullable=False)\n+    policy_tier = Column(String, nullable=False)\n+    issued_at = Column(DateTime, nullable=False, default=datetime.utcnow)\n+\n+    booking = relationship(\"Booking\", back_populates=\"refunds\")\n+\n+    def __repr__(self):\n+        return f\"<Refund {self.refund_id} booking={self.booking_id} {self.amount:.2f}>\"",
        "is_test": false,
        "symbols": null
      },
      {
        "id": "76aceadf30d3",
        "file": "booking_system_backend/schemas.py",
        "old_file": null,
        "kind": "hunk",
        "old_start": 0,
        "old_len": 0,
        "new_start": 0,
        "new_len": 0,
        "added": 2,
        "removed": 0,
        "patch": "@@ -58,0 +59,2 @@ class BookingOut(BaseModel):\n+    status: BookingStatus = BookingStatus.CONFIRMED\n+    cancelled_at: Optional[datetime] = None",
        "is_test": false,
        "symbols": null
      },
      {
        "id": "053883da3da1",
        "file": "booking_system_backend/schemas.py",
        "old_file": null,
        "kind": "hunk",
        "old_start": 0,
        "old_len": 0,
        "new_start": 0,
        "new_len": 0,
        "added": 4,
        "removed": 0,
        "patch": "@@ -71,0 +75,4 @@\n+class CancellationRequest(BaseModel):\n+    user_id: int\n+    name: str\n+    reason: Optional[str] = Field(default=None, max_length=280)",
        "is_test": false,
        "symbols": null
      },
      {
        "id": "f58b0494fc8b",
        "file": "booking_system_backend/schemas.py",
        "old_file": null,
        "kind": "hunk",
        "old_start": 0,
        "old_len": 0,
        "new_start": 0,
        "new_len": 0,
        "added": 9,
        "removed": 0,
        "patch": "@@ -75,0 +83,9 @@\n+\n+\n+class RefundOut(BaseModel):\n+    booking_id: int\n+    amount: float\n+    percentage: int\n+    policy_tier: str\n+    issued_at: datetime\n+    model_config = ConfigDict(from_attributes=True)",
        "is_test": false,
        "symbols": null
      },
      {
        "id": "2774339ed928",
        "file": "booking_system_backend/seed.py",
        "old_file": null,
        "kind": "hunk",
        "old_start": 0,
        "old_len": 0,
        "new_start": 0,
        "new_len": 0,
        "added": 1,
        "removed": 1,
        "patch": "@@ -64 +64 @@ def seed_bookings(db):\n-        db.add(Booking(user_id=u.user_id, flight_id=f.flight_id, booking_time=t))\n+        db.add(Booking(user_id=u.user_id, flight_id=f.flight_id, booking_time=t, status=BookingStatus.CONFIRMED))",
        "is_test": false,
        "symbols": null
      },
      {
        "id": "5bcbd8660e0d",
        "file": "booking_system_backend/services/booking.py",
        "old_file": null,
        "kind": "hunk",
        "old_start": 0,
        "old_len": 0,
        "new_start": 0,
        "new_len": 0,
        "added": 1,
        "removed": 1,
        "patch": "@@ -3 +3 @@\n-from models import Booking, Flight, User\n+from models import Booking, BookingStatus, Flight, User",
        "is_test": false,
        "symbols": null
      },
      {
        "id": "5f0e537bef4f",
        "file": "booking_system_backend/services/booking.py",
        "old_file": null,
        "kind": "hunk",
        "old_start": 0,
        "old_len": 0,
        "new_start": 0,
        "new_len": 0,
        "added": 1,
        "removed": 0,
        "patch": "@@ -38,0 +39,1 @@ def book_flight(db, user_id, name, flight_id):\n+        status=BookingStatus.CONFIRMED,",
        "is_test": false,
        "symbols": null
      },
      {
        "id": "822111ff1ea2",
        "file": "booking_system_backend/services/booking.py",
        "old_file": null,
        "kind": "hunk",
        "old_start": 0,
        "old_len": 0,
        "new_start": 0,
        "new_len": 0,
        "added": 5,
        "removed": 2,
        "patch": "@@ -61,2 +62,5 @@\n-def get_user_bookings(db, user_id):\n-    return db.query(Booking).filter(Booking.user_id == user_id).all()\n+def get_user_bookings(db, user_id, include_cancelled=False):\n+    query = db.query(Booking).filter(Booking.user_id == user_id)\n+    if not include_cancelled:\n+        query = query.filter(Booking.status == BookingStatus.CONFIRMED)\n+    return query.order_by(Booking.booking_time.desc()).all()",
        "is_test": false,
        "symbols": null
      },
      {
        "id": "4b959bc4b41b",
        "file": "booking_system_backend/services/booking.py",
        "old_file": null,
        "kind": "hunk",
        "old_start": 0,
        "old_len": 0,
        "new_start": 0,
        "new_len": 0,
        "added": 10,
        "removed": 0,
        "patch": "@@ -67,0 +71,10 @@\n+\n+def _get_booking_for_user(db, user_id, booking_id):\n+    booking = (\n+        db.query(Booking)\n+        .filter(Booking.booking_id == booking_id, Booking.user_id == user_id)\n+        .first()\n+    )\n+    if booking is None:\n+        raise LookupError(f\"Booking {booking_id} not found for user {user_id}\")\n+    return booking",
        "is_test": false,
        "symbols": null
      },
      {
        "id": "cd918ef4bcfd",
        "file": "booking_system_backend/services/flight.py",
        "old_file": null,
        "kind": "hunk",
        "old_start": 0,
        "old_len": 0,
        "new_start": 0,
        "new_len": 0,
        "added": 8,
        "removed": 0,
        "patch": "@@ -40,0 +41,8 @@\n+def release_seat(db, flight_id):\n+    flight = db.query(Flight).filter(Flight.flight_id == flight_id).with_for_update().first()\n+    if flight is None:\n+        raise LookupError(f\"Flight {flight_id} not found\")\n+    flight.seats_available = min(flight.seats_available + 1, flight.capacity)\n+    db.add(flight)\n+    return flight\n+",
        "is_test": false,
        "symbols": null
      },
      {
        "id": "a70bd8dddc50",
        "file": "booking_system_backend/services/flight.py",
        "old_file": null,
        "kind": "hunk",
        "old_start": 0,
        "old_len": 0,
        "new_start": 0,
        "new_len": 0,
        "added": 2,
        "removed": 1,
        "patch": "@@ -22 +22,2 @@ def list_flights(db):\n-    return db.query(Flight).all()\n+    flights = db.query(Flight).order_by(Flight.departure_time).all()\n+    return [f for f in flights if f.departure_time is not None]",
        "is_test": false,
        "symbols": null
      },
      {
        "id": "ba2b577acd65",
        "file": "booking_system_backend/services/policy.py",
        "old_file": null,
        "kind": "new_file",
        "old_start": 0,
        "old_len": 0,
        "new_start": 0,
        "new_len": 0,
        "added": 36,
        "removed": 0,